{
  "$schema": "https://json-schema.org/draft/2020-12/schema",
  "$id": "https://sinetti.ai/schemas/arbitration-case",
  "title": "ArbitrationCase",
  "description": "A portable decision record consumed by the reference arbitration operator.",
  "type": "object",
  "additionalProperties": false,
  "properties": {
    "version": { "const": "sinetti-arbitration-case/0.1" },
    "chain_id": { "type": "string", "pattern": "^[0-9]+$" },
    "escrow": { "type": "string", "pattern": "^0x[0-9a-fA-F]{40}$" },
    "arbitrator": { "type": "string", "pattern": "^0x[0-9a-fA-F]{40}$" },
    "deal_id": { "type": "string", "pattern": "^[0-9]+$" },
    "terms_hash": { "type": "string", "pattern": "^0x[0-9a-fA-F]{64}$" },
    "evidence_hash": { "type": "string", "pattern": "^0x[0-9a-fA-F]{64}$" },
    "proposed_outcome": { "enum": ["release", "refund"] },
    "rationale": { "type": "string", "minLength": 1, "pattern": "\\S" },
    "decided_at": {
      "type": "string",
      "format": "date-time",
      "pattern": "^\\d{4}-\\d{2}-\\d{2}T\\d{2}:\\d{2}:\\d{2}(?:\\.\\d+)?(?:Z|[+-]\\d{2}:\\d{2})$"
    }
  },
  "required": [
    "version",
    "chain_id",
    "escrow",
    "arbitrator",
    "deal_id",
    "terms_hash",
    "evidence_hash",
    "proposed_outcome",
    "rationale",
    "decided_at"
  ]
}
